text,options,answer,hint,category,tags,difficulty,points,requiredCoins,createdAt,updatedAt
"สัตว์ชนิดใดคอยาวที่สุด?","ยีราฟ|ม้าลาย|ช้าง|กวาง","ยีราฟ","กินใบไม้บนยอดไม้","ความรู้ทั่วไป","level-1|animal",1,1,1,2026-04-06T04:05:00.000Z,2026-04-06T04:05:00.000Z
"เราใช้อะไรดูเวลา?","นาฬิกา|ปฏิทิน|แว่นตา|เข็มทิศ","นาฬิกา","มีเข็มสั้นและเข็มยาว","ความรู้ทั่วไป","level-1|general",1,1,1,2026-04-06T04:05:00.000Z,2026-04-06T04:05:00.000Z
"ท้องฟ้าเวลาฝนจะตกมักมีสีอะไร?","ชมพู|ฟ้าใส|เทา/ดำ|เขียว","เทา/ดำ","เมฆฝน","ความรู้ทั่วไป","level-1|nature",1,1,1,2026-04-06T04:05:00.000Z,2026-04-06T04:05:00.000Z
"ส้มตำ เป็นอาหารที่ขึ้นชื่อของภาคใด?","ภาคเหนือ|ภาคใต้|ภาคอีสาน|ภาคกลาง","ภาคอีสาน","มักทานกับข้าวเหนียว","ความรู้ทั่วไป","level-1|food",1,1,1,2026-04-06T04:05:00.000Z,2026-04-06T04:05:00.000Z
"เราควรใช้สิ่งใดตัดกระดาษ?","มีด|กรรไกร|ขวาน|เลื่อย","กรรไกร","มีใบมีดคู่","ความรู้ทั่วไป","level-1|general",1,1,1,2026-04-06T04:05:00.000Z,2026-04-06T04:05:00.000Z
"ปลามีอวัยวะใดช่วยในการว่ายน้ำ?","ขา|ปีก|ครีบ|จมูก","ครีบ","ช่วยพยุงตัวและเคลื่อนที่","วิทยาศาสตร์","level-1|animal",1,1,1,2026-04-06T04:05:00.000Z,2026-04-06T04:05:00.000Z
"รุ้งกินน้ำมีทั้งหมดกี่สี?","5 สี|6 สี|7 สี|8 สี","7 สี","ม่วง คราม น้ำเงิน...","วิทยาศาสตร์","level-1|nature",1,1,1,2026-04-06T04:05:00.000Z,2026-04-06T04:05:00.000Z
"วันลอยกระทงตรงกับวันขึ้นกี่ค่ำ?","10 ค่ำ|13 ค่ำ|15 ค่ำ|1 ค่ำ","15 ค่ำ","คืนพระจันทร์เต็มดวง","ความรู้ทั่วไป","level-1|culture",1,1,1,2026-04-06T04:05:00.000Z,2026-04-06T04:05:00.000Z
"พาหนะใดแล่นบนราง?","รถเมล์|เรือ|รถไฟ|เครื่องบิน","รถไฟ","Train","ความรู้ทั่วไป","level-1|general",1,1,1,2026-04-06T04:05:00.000Z,2026-04-06T04:05:00.000Z
"1 สัปดาห์ มีกี่วัน?","5|6|7|8","7","จันทร์-อาทิตย์","ความรู้ทั่วไป","level-1|general",1,1,1,2026-04-06T04:05:00.000Z,2026-04-06T04:05:00.000Z
"ดาวเคราะห์ดวงใดมีขนาดใหญ่ที่สุดในระบบสุริยะ?","ดาวเสาร์|ดาวพฤหัสบดี|โลก|ดาวศุกร์","ดาวพฤหัสบดี","Jupiter","วิทยาศาสตร์","level-2|astronomy",2,5,5,2026-04-06T04:05:00.000Z,2026-04-06T04:05:00.000Z
"กำแพงเมืองจีนตั้งอยู่ในประเทศใด?","ญี่ปุ่น|เกาหลี|จีน|อินเดีย","จีน","China","ความรู้ทั่วไป","level-2|world",2,5,5,2026-04-06T04:05:00.000Z,2026-04-06T04:05:00.000Z
"สัตว์ชนิดใดไม่มีกระดูกสันหลัง?","แมว|นก|ปลาหมึก|จระเข้","ปลาหมึก","Squid","วิทยาศาสตร์","level-2|animal",2,5,5,2026-04-06T04:05:00.000Z,2026-04-06T04:05:00.000Z
"วันสงกรานต์ตรงกับเดือนใด?","มกราคม|เมษายน|ตุลาคม|ธันวาคม","เมษายน","ประเพณีปีใหม่ไทย","ความรู้ทั่วไป","level-2|culture",2,5,5,2026-04-06T04:05:00.000Z,2026-04-06T04:05:00.000Z
"แม่น้ำที่ยาวที่สุดในประเทศไทยคือ?","เจ้าพระยา|ปิง|ชี|มูล","ชี","ประมาณ 765 กิโลเมตร","ภูมิศาสตร์","level-2|thai",2,5,5,2026-04-06T04:05:00.000Z,2026-04-06T04:05:00.000Z
"ประเทศใดมีเกาะมากที่สุดในอาเซียน?","ฟิลิปปินส์|อินโดนีเซีย|ไทย|มาเลเซีย","อินโดนีเซีย","Indonesia","ภูมิศาสตร์","level-2|world",2,5,5,2026-04-06T04:05:00.000Z,2026-04-06T04:05:00.000Z
"สีแดง ผสม น้ำเงิน ได้สีอะไร?","ส้ม|ม่วง|เขียว|น้ำตาล","ม่วง","ผสมแม่สี","ความรู้ทั่วไป","level-2|art",2,5,5,2026-04-06T04:05:00.000Z,2026-04-06T04:05:00.000Z
"ก๊าซใดที่พืชใช้คายออกมาในตอนกลางวัน?","ออกซิเจน|ไนโตรเจน|คาร์บอนไดออกไซด์|ไฮโดรเจน","ออกซิเจน","Oxygen","วิทยาศาสตร์","level-2|nature",2,5,5,2026-04-06T04:05:00.000Z,2026-04-06T04:05:00.000Z
"อักษรภาษาอังกฤษมีกี่ตัว?","24|26|28|30","26","A-Z","ความรู้ทั่วไป","level-2|general",2,5,5,2026-04-06T04:05:00.000Z,2026-04-06T04:05:00.000Z
"1 ชั่วโมง มีกี่วินาที?","60|600|3,600|6,000","3,600","60 นาที x 60 วินาที","คณิตศาสตร์","level-2|math",2,5,5,2026-04-06T04:05:00.000Z,2026-04-06T04:05:00.000Z
"ใครเป็นผู้ประดิษฐ์อักษรไทย?","พ่อขุนศรีอินทราทิตย์|พ่อขุนรามคำแหง|ร.1|ร.5","พ่อขุนรามคำแหง","ศิลาจารึกหลักที่ 1","ประวัติศาสตร์","level-3|thai",3,10,10,2026-04-06T04:05:00.000Z,2026-04-06T04:05:00.000Z
"ธาตุชนิดใดมีสัญลักษณ์ว่า 'Na'?","ไนโตรเจน|โซเดียม|นีออน|เหล็ก","โซเดียม","Natrium","วิทยาศาสตร์","level-3|chemistry",3,10,10,2026-04-06T04:05:00.000Z,2026-04-06T04:05:00.000Z
"เมืองหลวงของประเทศออสเตรเลียคือ?","ซิดนีย์|เมลเบิร์น|แคนเบอร์รา|เพิร์ท","แคนเบอร์รา","Canberra","ภูมิศาสตร์","level-3|world",3,10,10,2026-04-06T04:05:00.000Z,2026-04-06T04:05:00.000Z
"วิตามินเอ มีมากในอาหารประเภทใด?","ไขมัน|ผักใบเขียวและเหลือง|แป้ง|น้ำตาล","ผักใบเขียวและเหลือง","บำรุงสายตา","วิทยาศาสตร์","level-3|health",3,10,10,2026-04-06T04:05:00.000Z,2026-04-06T04:05:00.000Z
"ใครคือพระเจ้าตากสินมหาราช สถาปนากรุงอะไร?","สุโขทัย|อยุธยา|ธนบุรี|รัตนโกสินทร์","ธนบุรี","กอบกู้เอกราชครั้งที่ 2","ประวัติศาสตร์","level-3|thai",3,10,10,2026-04-06T04:05:00.000Z,2026-04-06T04:05:00.000Z
"อวัยวะใดทำหน้าที่สูบฉีดเลือดไปเลี้ยงร่างกาย?","ปอด|ตับ|ไต|หัวใจ","หัวใจ","Heart","วิทยาศาสตร์","level-3|health",3,10,10,2026-04-06T04:05:00.000Z,2026-04-06T04:05:00.000Z
"ยอดเขาที่สูงที่สุดในประเทศไทยคือ?","ดอยตุง|ภูกระดึง|ดอยอินทนนท์|ดอยเชียงดาว","ดอยอินทนนท์","จังหวัดเชียงใหม่","ภูมิศาสตร์","level-3|thai",3,10,10,2026-04-06T04:05:00.000Z,2026-04-06T04:05:00.000Z
"ใครคือผู้วาดภาพ 'The Last Supper'?","แวน โก๊ะ|ปิกัสโซ|เลโอนาร์โด ดา วินชี|ราฟาเอล","เลโอนาร์โด ดา วินชี","Leonardo da Vinci","ศิลปะ","level-3|world",3,10,10,2026-04-06T04:05:00.000Z,2026-04-06T04:05:00.000Z
"คลองใดเชื่อมมหาสมุทรแปซิฟิกและแอตแลนติก?","คลองสุเอซ|คลองปานามา|คลองคีล|คลองคอคอดกระ","คลองปานามา","Panama Canal","ภูมิศาสตร์","level-3|world",3,10,10,2026-04-06T04:05:00.000Z,2026-04-06T04:05:00.000Z
"มุมฉากมีขนาดกี่องศา?","45|90|180|360","90","พื้นฐานเรขาคณิต","คณิตศาสตร์","level-3|math",3,10,10,2026-04-06T04:05:00.000Z,2026-04-06T04:05:00.000Z
"สงครามเย็นเป็นการต่อสู้ทางอุดมการณ์ระหว่างใคร?","เยอรมนี-ญี่ปุ่น|สหรัฐฯ-โซเวียต|อังกฤษ-ฝรั่งเศส|จีน-อินเดีย","สหรัฐฯ-โซเวียต","ประชาธิปไตย vs คอมมิวนิสต์","ประวัติศาสตร์","level-4|world",4,15,15,2026-04-06T04:05:00.000Z,2026-04-06T04:05:00.000Z
"ประเทศใดมีพื้นที่ป่าฝนอเมซอนมากที่สุด?","เปรู|บราซิล|โคลอมเบีย|เวเนซุเอลา","บราซิล","Brazil","ภูมิศาสตร์","level-4|world",4,15,15,2026-04-06T04:05:00.000Z,2026-04-06T04:05:00.000Z
"ธาตุโลหะชนิดใดที่เป็นของเหลวที่อุณหภูมิห้อง?","เหล็ก|ทองแดง|ปรอท|ทองคำ","ปรอท","Mercury (Hg)","วิทยาศาสตร์","level-4|chemistry",4,15,15,2026-04-06T04:05:00.000Z,2026-04-06T04:05:00.000Z
"จังหวัดใดเป็นจังหวัดที่ 77 ของประเทศไทย?","บึงกาฬ|สระแก้ว|อำนาจเจริญ|หนองบัวลำภู","บึงกาฬ","แยกจากหนองคาย","ภูมิศาสตร์","level-4|thai",4,15,15,2026-04-06T04:05:00.000Z,2026-04-06T04:05:00.000Z
"ใครคือผู้ค้นพบทฤษฎีแรงโน้มถ่วง?","ไอน์สไตน์|นิวตัน|กาลิเลโอ|ฮอว์คิง","นิวตัน","Isaac Newton","วิทยาศาสตร์","level-4|physics",4,15,15,2026-04-06T04:0