text,options,answer,hint,category,tags,difficulty,points,requiredCoins,createdAt,updatedAt
"อุปกรณ์ใดใช้สำหรับสำรองไฟล์งานภายนอกคอมพิวเตอร์?","แรม|ฮาร์ดดิสก์พกพา (External HDD)|เมาส์|ลำโพง","ฮาร์ดดิสก์พกพา (External HDD)","เสียบผ่านช่อง USB","เทคโนโลยี","level-1|tech",1,1,1,2026-04-06T03:10:00.000Z,2026-04-06T03:10:00.000Z
"สัตว์ชนิดใดมีจมูกยาวที่เรียกว่างวง?","ยีราฟ|ช้าง|แรด|เสือ","ช้าง","สัตว์บกที่มีขนาดใหญ่ที่สุด","ความรู้ทั่วไป","level-1|animal",1,1,1,2026-04-06T03:10:00.000Z,2026-04-06T03:10:00.000Z
"เรารูปทรงใดที่มีด้านเท่ากัน 3 ด้าน?","สี่เหลี่ยม|วงกลม|สามเหลี่ยมด้านเท่า|ห้าเหลี่ยม","สามเหลี่ยมด้านเท่า","มุมทุกมุมกาง 60 องศา","คณิตศาสตร์","level-1|math",1,1,1,2026-04-06T03:10:00.000Z,2026-04-06T03:10:00.000Z
"อาหารประจำชาติของอเมริกาที่เป็นขนมปังประกบเนื้อ?","พิซซ่า|แฮมเบอร์เกอร์|ซูชิ|เฝอ","แฮมเบอร์เกอร์","มักขายในร้านฟาสต์ฟู้ด","ความรู้ทั่วไป","level-1|food",1,1,1,2026-04-06T03:10:00.000Z,2026-04-06T03:10:00.000Z
"สีไฟจราจรใดบอกให้ 'ชะลอ' เพื่อเตรียมหยุด?","แดง|เขียว|เหลือง|ฟ้า","เหลือง","สว่างก่อนไฟแดง","ความรู้ทั่วไป","level-1|general",1,1,1,2026-04-06T03:10:00.000Z,2026-04-06T03:10:00.000Z
"พืชส่วนใดทำหน้าที่สืบพันธุ์และมีสีสวยงาม?","ราก|ใบ|ดอก|ลำต้น","ดอก","ใช้ล่อแมลง","วิทยาศาสตร์","level-1|nature",1,1,1,2026-04-06T03:10:00.000Z,2026-04-06T03:10:00.000Z
"เราควรล้างมืออย่างน้อยกี่วินาทีเพื่อความสะอาด?","5 วินาที|10 วินาที|20 วินาที|60 วินาที","20 วินาที","ร้องเพลงช้างจบสองรอบพอดี","ความรู้ทั่วไป","level-1|health",1,1,1,2026-04-06T03:10:00.000Z,2026-04-06T03:10:00.000Z
"เลข ๑ ในไทยเขียนแทนเลขอะไรในสากล?","1|2|3|4","1","เลขตัวแรก","ภาษาไทย","level-1|thai",1,1,1,2026-04-06T03:10:00.000Z,2026-04-06T03:10:00.000Z
"สัตว์ชนิดใดพ่นน้ำออกจากหัวและอาศัยในทะเล?","ฉลาม|วาฬ|โลมา|หมึก","วาฬ","สัตว์เลี้ยงลูกด้วยนมที่ใหญ่ที่สุด","ความรู้ทั่วไป","level-1|animal",1,1,1,2026-04-06T03:10:00.000Z,2026-04-06T03:10:00.000Z
"10 + 25 = ?","30|35|40|45","35","บวกเลขพื้นฐาน","คณิตคิดไว","level-1|math",1,1,1,2026-04-06T03:10:00.000Z,2026-04-06T03:10:00.000Z
"ในคอมพิวเตอร์ GPU ย่อมาจาก Graphics ... Unit?","Power|Processing|Programming|Primary","Processing","ใช้ประมวลผลภาพ","เทคโนโลยี","level-2|tech",2,5,5,2026-04-06T03:10:00.000Z,2026-04-06T03:10:00.000Z
"ใน JavaScript เมธอด 'Array.shift()' ทำหน้าที่อะไร?","ลบตัวแรกออก|ลบตัวสุดท้ายออก|เพิ่มตัวแรก|เพิ่มตัวสุดท้าย","ลบตัวแรกออก","Remove the first element","เทคโนโลยี","level-2|dev",2,5,5,2026-04-06T03:10:00.000Z,2026-04-06T03:10:00.000Z
"ดาวเคราะห์ดวงใดคือ 'ฝาแฝด' ของโลก?","ดาวศุกร์|ดาวอังคาร|ดาวพฤหัสบดี|เนปจูน","ดาวศุกร์","มีขนาดและมวลใกล้เคียงกัน","วิทยาศาสตร์","level-2|astronomy",2,5,5,2026-04-06T03:10:00.000Z,2026-04-06T03:10:00.000Z
"ใครคือผู้ประดิษฐ์เครื่องบินคนแรก?","เอดิสัน|พี่น้องไรต์|เทสลา|นิวตัน","พี่น้องไรต์","Wright Brothers","ประวัติศาสตร์","level-2|world",2,5,5,2026-04-06T03:10:00.000Z,2026-04-06T03:10:00.000Z
"จังหวัดใดขึ้นชื่อเรื่อง 'โมจิ' และปากน้ำโพ?","ขอนแก่น|นครสวรรค์|พิษณุโลก|พิจิตร","นครสวรรค์","เมืองต้นแม่น้ำเจ้าพระยา","ภูมิศาสตร์","level-2|thai",2,5,5,2026-04-06T03:10:00.000Z,2026-04-06T03:10:00.000Z
"ปุ่มลัด 'Ctrl + S' ใช้ทำอะไร?","Save|Undo|Cut|Paste","Save","บันทึกไฟล์งาน","เทคโนโลยี","level-2|tech",2,5,5,2026-04-06T03:10:00.000Z,2026-04-06T03:10:00.000Z
"สัตว์เลี้ยงลูกด้วยนมชนิดใดบินได้?","นกพิราบ|ค้างคาว|ผีเสื้อ|ไก่","ค้างคาว","อาศัยในถ้ำ","วิทยาศาสตร์","level-2|animal",2,5,5,2026-04-06T03:10:00.000Z,2026-04-06T03:10:00.000Z
"สีแดง ผสม น้ำเงิน ได้สีอะไร?","ส้ม|ม่วง|เขียว|เทา","ม่วง","ผสมแม่สีพื้นฐาน","ความรู้ทั่วไป","level-2|art",2,5,5,2026-04-06T03:10:00.000Z,2026-04-06T03:10:00.000Z
"มหาสมุทรที่กว้างที่สุดคือ?","แอตแลนติก|อินเดีย|แปซิฟิก|อาร์กติก","แปซิฟิก","Pacific Ocean","ภูมิศาสตร์","level-2|world",2,5,5,2026-04-06T03:10:00.000Z,2026-04-06T03:10:00.000Z
"50 x 4 = ?","100|150|200|250","200","การคูณพื้นฐาน","คณิตคิดไว","level-2|math",2,5,5,2026-04-06T03:10:00.000Z,2026-04-06T03:10:00.000Z
"ในฐานข้อมูล NoSQL 'MongoDB' เก็บข้อมูลในรูปแบบใด?","Table|BSON/JSON|Graph|Key-Value","BSON/JSON","Document-oriented database","เทคโนโลยี","level-3|dev",3,10,10,2026-04-06T03:10:00.000Z,2026-04-06T03:10:00.000Z
"Node.js โมดูลใดใช้จัดการเรื่อง 'Path' ของไฟล์?","fs|http|path|url","path","Handling file paths","เทคโนโลยี","level-3|dev",3,10,10,2026-04-06T03:10:00.000Z,2026-04-06T03:10:00.000Z
"ใครคือพระมหากษัตริย์ที่ประกาศอิสรภาพที่เมืองแครง?","ตากสิน|สมเด็จพระนเรศวร|ร.1|ร.5","สมเด็จพระนเรศวร","มหาราชแห่งอยุธยา","ประวัติศาสตร์","level-3|thai",3,10,10,2026-04-06T03:10:00.000Z,2026-04-06T03:10:00.000Z
"ธาตุใดมีสัญลักษณ์ 'Cu'?","เงิน|ทองแดง|เหล็ก|ปรอท","ทองแดง","Cuprum","วิทยาศาสตร์","level-3|chemistry",3,10,10,2026-04-06T03:10:00.000Z,2026-04-06T03:10:00.000Z
"ยอดเขาที่สูงที่สุดในยุโรปคือ?","มองบลังค์|เอลบรุส|อูรัล|แอลป์","เอลบรุส","Mount Elbrus ในรัสเซีย","ภูมิศาสตร์","level-3|world",3,10,10,2026-04-06T03:10:00.000Z,2026-04-06T03:10:00.000Z
"อวัยวะใดทำหน้าที่แลกเปลี่ยนก๊าซ?","หัวใจ|ตับ|ไต|ปอด","ปอด","Lungs","วิทยาศาสตร์","level-3|health",3,10,10,2026-04-06T03:10:00.000Z,2026-04-06T03:10:00.000Z
"ใครคือผู้วาดภาพ 'Mona Lisa'?","ปิกัสโซ|ดา วินชี|แวน โก๊ะ|ราฟาเอล","ดา วินชี","Leonardo da Vinci","ศิลปะ","level-3|world",3,10,10,2026-04-06T03:10:00.000Z,2026-04-06T03:10:00.000Z
"ประเทศที่มีเกาะมากที่สุดในอาเซียน?","ฟิลิปปินส์|ไทย|อินโดนีเซีย|สิงคโปร์","อินโดนีเซีย","มีมากกว่า 17,000 เกาะ","ภูมิศาสตร์","level-3|world",3,10,10,2026-04-06T03:10:00.000Z,2026-04-06T03:10:00.000Z
"วิตามินใดช่วยป้องกันโรคตาฟาง?","A|B1|C|D","A","พบมากในฟักทอง","วิทยาศาสตร์","level-3|health",3,10,10,2026-04-06T03:10:00.000Z,2026-04-06T03:10:00.000Z
"ในคณิตศาสตร์ 'เลขพัลลภ' (Palindrome) คืออะไร?","เลขลบ|เลขที่อ่านหน้าหลังได้เท่าเดิม|เลขเฉพาะ|เลขคี่","เลขที่อ่านหน้าหลังได้เท่าเดิม","เช่น 121, 5005","คณิตศาสตร์","level-3|math",3,10,10,2026-04-06T03:10:00.000Z,2026-04-06T03:10:00.000Z
"ในการเขียนโปรแกรม SOLID หลักการ 'L' คือ?","Logging|Layering|Liskov Substitution|Linking","Liskov Substitution","คลาสลูกแทนแม่ได้","เทคโนโลยี","level-4|dev",4,15,15,2026-04-06T03:10:00.000Z,2026-04-06T03:10:00.000Z
"ใน Node.js เฟสใดรัน callbacks ของ setTimeout?","Poll|Check|Timers|Close","Timers","เฟสแรกของ Event Loop","เทคโนโลยี","level-4|dev",4,15,15,2026-04-06T03:10:00.000Z,2026-04-06T03:10:00.000Z
"สงครามเย็นเป็นการแข่งระหว่างมหาอำนาจขั้วใด?","อังกฤษ-ฝรั่งเศส|เยอรมัน-ญี่ปุ่น|สหรัฐฯ-โซเวียต|จีน-อินเดีย","สหรัฐฯ-โซเวียต","สงครามอุดมการณ์","ประวัติศาสตร์","level-4|world",4,15,15,2026-04-06T03:10:00.000Z,2026-04-06T03:10:00.000Z
"ดาวเคราะห์ใดฉายา 'ดาวแดง'?","ศุกร์|อังคาร|พุธ|เนปจูน","อังคาร","Mars มีเหล็กออกไซด์สูง","วิทยาศาสตร์","level-4|astronomy",4,15,15,2026-04-06T03:10:00.000Z,2026-04-06T03:10:00.000Z
"จังหวัดใต้สุดของไทยคือจังหวัดใด?","สงขลา|ยะลา|นราธิวาส|สตูล","ยะลา","อำเภอเบตง","ภูมิศาสตร์","level-4|thai",4,15,15,2026-04-06T03:10:00.000Z,2026-04-06T03:10:00.000Z
"ในระบบ HTTPS ตัว 'S' หมายถึง?","System|Secure|Simple|Standard","Secure","การส่งข้อมูลเข้ารหัส","เทคโนโลยี","level-4|tech",4,15,15,2026-04-06T03:10:00.000Z,2026-04-06T03:10:00.000Z
"ใครค้นพบทฤษฎีแรงโน้มถ่วง?","ไอน์สไตน์|นิวตัน|กาลิเลโอ|ฮอว์คิง","นิวตัน","Isaac Newton","วิทยาศาสตร์","level-4|physics",4,15,15,2026-04-06T03:10:00.000Z,2026-04-06T03:10:00.000Z
"เหตุการณ์ '14 ตุลา' เกิดปีใด?","2510|2516|2519|2535","2516","การประท้วงเรียกร้องประชาธิปไตย","ประวัติศาสตร์","level-4|thai",4,15,15,2026-04-06T03:10:00.000Z,2026-04-06T03:10:00.000Z
"Design Pattern แบบ Factory ใช้เพื่ออะไร?","จัดการ DB|สร้างวัตถุ (Object)|ลบข้อมูล|ส่งเมล","สร้างวัตถุ (Object)","Creational Pattern","เทคโนโลยี","level-4|dev",4,15,15,2026-04-06T03:10:00.000Z,2026-04-06T03:10:00.000Z
"ใครแต่งเรื่อง 'พระอภัยมณี'?","ร.2|สุนทรภู่|ร.6|น.ม.ส.","สุนทรภู่","กวีเอกของสยาม","วรรณคดี","level-4|thai",4,15,15,2026-04-06T03:10:00.000Z,2026-04-06T03:10:00.000Z
"ใน Distributed System 'CAP Theorem' ตัว P คือ?","Partition Tolerance|Performance|Processing|Persistence","Partition Tolerance","ทำงานได้แม้เครือข่ายขาดขาด","เทคโนโลยี","level-5|dev",5,20,20,2026-04-06T03:10:00.000Z,2026-04-06T03:10:00.000Z
"อนุภาคใดในอะตอมไม่มีประจุไฟฟ้า?","โปรตอน|อิเล็กตรอน|นิวตรอน|โฟตอน","นิวตรอน","Neutron","วิทยาศาสตร์","level-5|physics",5,20,20,2026-04-06T03:10:00.000Z,2026-04-06T03:10:00.000Z
"ธาตุใดจุดหลอมเหลวสูงสุด?","เหล็ก|ทองคำ|ทังสเตน|คาร์บอน","คาร์บอน","ระเหิดที่อุณหภูมิสูงมาก (แกรไฟต์)","วิทยาศาสตร์","level-5|chemistry",5,20,20,2026-04-06T03:10:00.000Z,2026-04-06T03:10:00.000Z
"ประเทศที่มีเขตเวลา (Time Zones) มากที่สุด?","รัสเซีย|จีน|ฝรั่งเศส|สหรัฐฯ","ฝรั่งเศส","นับรวมดินแดนโพ้นทะเล (12 เขต)","ภูมิศาสตร์","level-5|world",5,20,20,2026-04-06T03:10:00.000Z,2026-04-06T03:10:00.000Z
"ใครคือบิดาแห่งคอมพิวเตอร์สมัยใหม่?","แบบบิจ|ทัวริง|จอบส์|เกตส์","ทัวริง","Alan Turing","เทคโนโลยี","level-5|tech",5,20,20,2026-04-06T03:10:00.000Z,2026-04-06T03:10:00.000Z
"การโจมตีแบบ 'Zero-day' คืออะไร?","โจมตีตอนเที่ยงคืน|ใช้ช่องโหว่ยังไม่มี Patch|โจมตีไวรัสเก่า|ไม่มีข้อมูล","ใช้ช่องโหว่ยังไม่มี Patch","ไม่มีเวลาให้ป้องกัน","เทคโนโลยี","level-5|security",5,20,20,2026-04-06T03:10:00.000Z,2026-04-06T03:10:00.000Z
"ใครวางรากฐาน 'ทฤษฎีเกม'?","อดัม สมิธ|จอห์น แนช|นิวตัน|ไอน์สไตน์","จอห์น แนช","John Nash (A Beautiful Mind)","ความรู้ทั่วไป","level-5|economics",5,20,20,2026-04-06T03:10:00.000Z,2026-04-06T03:10:00.000Z
"สนธิสัญญา 'เวสต์ฟาเลีย' ปี ค.ศ. ใด?","1648|1789|1815|1919","1648","จุดกำเนิดรัฐชาติสมัยใหม่","ประวัติศาสตร์","level-5|world",5,20,20,2026-04-06T03:10:00.000Z,2026-04-06T03:10:00.000Z
"สถาปัตยกรรม 'Microservices' สื่อสารผ่าน?","Shared DB|API (REST/gRPC)|Global Var|Shared Mem","API (REST/gRPC)","Inter-service communication","เทคโนโลยี","level-5|dev",5,20,20,2026-04-06T03:10:00.000Z,2026-04-06T03:10:00.000Z
"สตรีคนแรกที่ได้รางวัลโนเบล?","มารี คูรี|แม่ชีเทเรซา|มาลาลา|อินทิรา","มารี คูรี","Marie Curie (ฟิสิกส์และเคมี)","วิทยาศาสตร์","level-5|world",5,20,20,2026-04-06T03:10:00.000Z,2026-04-06T03:10:00.000Z